{
  "schemaVersion": 2,
  "channel": "beta",
  "manager": {
    "id": "com.badru.myvibe",
    "name": "MyVibe",
    "version": "0.4.0",
    "minimumOsVersion": "13.0",
    "artifacts": [
      {
        "platform": "macos",
        "architecture": "universal",
        "downloadUrl": "https://github.com/badrulmokhtar/myvibe/releases/download/myvibe-v0.4.0/MyVibe-0.4.0-beta.1-macos-universal.zip",
        "sha256": "f78b54defcb643f2f72fa1a38bf6190569645497558d1fa0a4c540e3d9f00a92",
        "signature": {
          "type": "developer-id",
          "required": false
        }
      },
      {
        "platform": "windows",
        "architecture": "x64",
        "downloadUrl": "https://github.com/badrulmokhtar/myvibe/releases/download/myvibe-v0.4.0/MyVibe-0.4.0-beta.1-win-x64.zip",
        "sha256": "f8444e2acc8b65de0e3a01262b04c681f7d30d32afce9a2ac8fb61f8846085bb",
        "signature": {
          "type": "authenticode",
          "required": false
        }
      }
    ]
  },
  "plugins": [
    {
      "id": "com.badru.transform2d5",
      "name": "2.5D Transform",
      "version": "0.9.5",
      "description": "Create precise 2.5D views while keeping text, vectors, gradients, and linked artwork editable.",
      "host": "Adobe Illustrator",
      "hostVersion": "30.x",
      "minimumManagerVersion": "0.4.0",
      "artifacts": [
        {
          "platform": "macos",
          "architecture": "universal",
          "downloadUrl": "https://github.com/badrulmokhtar/myvibe/releases/download/transform2d5-v0.9.5/2.5D-Transform-0.9.5-beta-macos-universal.zip",
          "sha256": "b42e7861ac4d821d26e25439315b25d97ee653ed5f3844b38f6193b775b23e14",
          "signature": {
            "type": "developer-id",
            "required": false
          }
        },
        {
          "platform": "windows",
          "architecture": "x64",
          "downloadUrl": "https://github.com/badrulmokhtar/myvibe/releases/download/transform2d5-v0.9.5/2.5D-Transform-0.9.5-beta-win-x64.zip",
          "sha256": "88dfa7099458b53ee7d78006c247f368c7470aaa89fed7a426648faa48932944",
          "signature": {
            "type": "authenticode",
            "required": false
          }
        }
      ]
    },
    {
      "id": "com.badru.tonemesh",
      "name": "ToneMesh",
      "version": "0.9.9",
      "description": "Build editable halftone fields with custom marks while pausing hidden-panel selection monitoring to keep Illustrator responsive.",
      "host": "Adobe Illustrator",
      "hostVersion": "30.x",
      "minimumManagerVersion": "0.4.0",
      "artifacts": [
        {
          "platform": "macos",
          "architecture": "universal",
          "downloadUrl": "https://github.com/badrulmokhtar/myvibe/releases/download/tonemesh-v0.9.9/ToneMesh-0.9.9-beta-macos-universal.zip",
          "sha256": "ef7a73f32c11017632d7df337c7fdc43ed0b933dd5e3a503c0bb6c4c0bbfddfc",
          "signature": {
            "type": "developer-id",
            "required": false
          }
        },
        {
          "platform": "windows",
          "architecture": "x64",
          "downloadUrl": "https://github.com/badrulmokhtar/myvibe/releases/download/tonemesh-v0.9.9/ToneMesh-0.9.9-beta-win-x64.zip",
          "sha256": "94f56c2d0a7c1fa4412357a9669d9b54ee9ef360065cd74a9b0c67be5b08da8f",
          "signature": {
            "type": "authenticode",
            "required": false
          }
        }
      ],
      "releases": [
        {
          "version": "0.9.9",
          "releasedAt": "2026-09-12",
          "artifacts": [
            {
              "platform": "macos",
              "architecture": "universal",
              "downloadUrl": "https://github.com/badrulmokhtar/myvibe/releases/download/tonemesh-v0.9.9/ToneMesh-0.9.9-beta-macos-universal.zip",
              "sha256": "ef7a73f32c11017632d7df337c7fdc43ed0b933dd5e3a503c0bb6c4c0bbfddfc",
              "signature": { "type": "developer-id", "required": false }
            },
            {
              "platform": "windows",
              "architecture": "x64",
              "downloadUrl": "https://github.com/badrulmokhtar/myvibe/releases/download/tonemesh-v0.9.9/ToneMesh-0.9.9-beta-win-x64.zip",
              "sha256": "94f56c2d0a7c1fa4412357a9669d9b54ee9ef360065cd74a9b0c67be5b08da8f",
              "signature": { "type": "authenticode", "required": false }
            }
          ]
        },
        {
          "version": "0.9.8",
          "releasedAt": "2026-08-24",
          "artifacts": [
            {
              "platform": "macos",
              "architecture": "universal",
              "downloadUrl": "https://github.com/badrulmokhtar/myvibe/releases/download/tonemesh-v0.9.8/ToneMesh-0.9.8-beta-macos-universal.zip",
              "sha256": "5683239e2d905cd6eb94cfa29c07207a1cd657aefe2a23d96598cd7fbf672f19",
              "signature": { "type": "developer-id", "required": false }
            },
            {
              "platform": "windows",
              "architecture": "x64",
              "downloadUrl": "https://github.com/badrulmokhtar/myvibe/releases/download/tonemesh-v0.9.8/ToneMesh-0.9.8-beta-win-x64.zip",
              "sha256": "ff87b3c97f3c27b8ad4ec8989f6b24be205422506c12d4d7883f0a4556f514c4",
              "signature": { "type": "authenticode", "required": false }
            }
          ]
        }
      ]
    }
  ]
}
